{"acceptanceCriteria":["AP-DATAFLOW-AC01","AP-DATAFLOW-AC02","AP-DATAFLOW-AC03","AP-DATAFLOW-AC04","AP-DATAFLOW-AC05"],"caseMatrix":[{"caseType":"POSITIVE","layerId":"SOURCE","matchesOracle":true,"observed":"ACCEPTED","oracle":"ACCEPTED"},{"caseType":"DUPLICATE","layerId":"SOURCE","matchesOracle":true,"observed":"DUPLICATE_CONTENT_DENIED","oracle":"DUPLICATE_CONTENT_DENIED"},{"caseType":"TAMPER","layerId":"SOURCE","matchesOracle":true,"observed":"TAMPERED_CONTENT_DENIED","oracle":"TAMPERED_CONTENT_DENIED"},{"caseType":"MISSING_INFORMATION","layerId":"EXTRACTION","matchesOracle":true,"observed":"EXTRACTION_FIELD_UNKNOWN","oracle":"EXTRACTION_FIELD_UNKNOWN"},{"caseType":"UNSUPPORTED_FIELD","layerId":"EXTRACTION","matchesOracle":true,"observed":"UNSUPPORTED_EXTRACTION_FIELD_DENIED","oracle":"UNSUPPORTED_EXTRACTION_FIELD_DENIED"},{"caseType":"MATERIAL_FIELD_CHANGE","layerId":"MATCHING","matchesOracle":true,"observed":"CONFLICT","oracle":"CONFLICT"},{"caseType":"TOLERATED_CHANGE","layerId":"MATCHING","matchesOracle":true,"observed":"MATCHED","oracle":"MATCHED"},{"caseType":"MISSING_CONTEXT","layerId":"EXCEPTION_ADVISOR","matchesOracle":true,"observed":"MISSING_CONTEXT","oracle":"MISSING_CONTEXT"},{"caseType":"UNVERIFIED_EVIDENCE","layerId":"EXCEPTION_ADVISOR","matchesOracle":true,"observed":"UNVERIFIED_REFERENCE_EVIDENCE","oracle":"UNVERIFIED_REFERENCE_EVIDENCE"},{"caseType":"CONTRADICTORY_SUBSTITUTION","layerId":"VALIDATION","matchesOracle":true,"observed":"DATAFLOW_IDENTITY_MISMATCH","oracle":"DATAFLOW_IDENTITY_MISMATCH"},{"caseType":"REPLAY","layerId":"RECEIPT_EVIDENCE_VERDICT","matchesOracle":true,"observed":"7439c7724296af12b0c7f82b4b965448937833cefaad3fdc7ded53f54ff28e64","oracle":"7439c7724296af12b0c7f82b4b965448937833cefaad3fdc7ded53f54ff28e64"}],"chain":[{"capabilityId":"chimpmaera.incoming-invoice/intake-request/v1","evidenceClass":"EXECUTED","evidenceClassBasis":"the released AP-02 intake implementation was executed on the actual frozen synthetic supplier invoice bytes","executed":true,"layerId":"SOURCE","moduleIdentity":{"byteLength":17628,"sha256":"38490af300dce7965deebf56755ac59be117db711bd7bc478e19538947a412fc"},"modulePath":"packages/contracts/src/incoming-invoice-intake.ts","observed":"ACCEPTED; duplicate and tampered copies denied","ordinal":1},{"capabilityId":"chimpmaera.incoming-invoice/intake-record/v1","evidenceClass":"EXECUTED","evidenceClassBasis":"the released AP-02 integrity readback was executed against the persisted document version and re-checked content, metadata, identity and record digests","executed":true,"layerId":"DOCUMENT","moduleIdentity":{"byteLength":17628,"sha256":"38490af300dce7965deebf56755ac59be117db711bd7bc478e19538947a412fc"},"modulePath":"packages/contracts/src/incoming-invoice-intake.ts","observed":"FOUND (version-bound)","ordinal":2},{"capabilityId":"chimpmaera.incoming-invoice/bounded-extraction-report/v1","evidenceClass":"EXECUTED","evidenceClassBasis":"the bounded deterministic synthetic extraction executed on the ingested document version (no OCR, no model inference); the frozen AP-03 benchmark/holdout stays excluded from the proof inputs","executed":true,"layerId":"EXTRACTION","moduleIdentity":{"byteLength":19727,"sha256":"d7aaf42607c521db66b0b6fd209c033c4eb75a01ae023d430888a6681f98d2fe"},"modulePath":"packages/contracts/src/incoming-invoice-extraction-dataflow-v2.ts","observed":"e340d085f52dfd0773228546da917158ef38fde8150dd05fdb8705ef5bd73d33","ordinal":3},{"capabilityId":"chimpmaera.incoming-invoice/extraction-dataflow/v2","evidenceClass":"SCHEMA_VALIDATED","evidenceClassBasis":"the composed extraction/dataflow record was validated against its versioned JSON schema and the frozen AP-04 pack identity; no separate validation engine was executed in this slice","executed":false,"layerId":"VALIDATION","moduleIdentity":{"byteLength":19727,"sha256":"d7aaf42607c521db66b0b6fd209c033c4eb75a01ae023d430888a6681f98d2fe"},"modulePath":"packages/contracts/src/incoming-invoice-extraction-dataflow-v2.ts","observed":"SCHEMA_VALIDATED","ordinal":4},{"capabilityId":"chimpmaera.incoming-invoice/erv-core/v1","evidenceClass":"EXECUTED","evidenceClassBasis":"the released AP-04 ERV core executed over the case composed from the observed extracted fields under the frozen variant registry","executed":true,"layerId":"MATCHING","moduleIdentity":{"byteLength":21114,"sha256":"6ba5250783df35f60602a11437c843272ab014bf24e69135cfbf52dfb41750cf"},"modulePath":"packages/contracts/src/incoming-invoice-erv.ts","observed":"MATCHED","ordinal":5},{"capabilityId":"chimpmaera.incoming-invoice/erv-core/v1","evidenceClass":"EXECUTED","evidenceClassBasis":"the released AP-04 typed exceptions and evidence-citing advisors executed for the missing-context and unverified-evidence controls","executed":true,"layerId":"EXCEPTION_ADVISOR","moduleIdentity":{"byteLength":21114,"sha256":"6ba5250783df35f60602a11437c843272ab014bf24e69135cfbf52dfb41750cf"},"modulePath":"packages/contracts/src/incoming-invoice-erv.ts","observed":"MISSING_CONTEXT; UNVERIFIED_REFERENCE_EVIDENCE","ordinal":6},{"capabilityId":"chimpmaera.incoming-invoice/adaptive-ui/v1","evidenceClass":"SOURCE_BOUND","evidenceClassBasis":"the released adaptive-UI source is bound by byte-identical digest only; its producer was NOT executed in this bounded slice","executed":false,"layerId":"ADAPTIVE_UI","moduleIdentity":{"byteLength":33045,"sha256":"e60fb079364bc48d12629825531299bc7abd9986c5299067e450e7577ef75b1f"},"modulePath":"packages/contracts/src/incoming-invoice-adaptive-ui.ts","observed":"NOT_EXECUTED_IN_THIS_SLICE","ordinal":7},{"capabilityId":"chimpmaera.incoming-invoice/ap05-receipt-manifest/v1","evidenceClass":"SCHEMA_VALIDATED","evidenceClassBasis":"the released AP-05 receipt-manifest source is bound by byte-identical digest and this v2 probe record is validated against its versioned schema; no receipt-manifest producer ran in this slice","executed":false,"layerId":"RECEIPT_EVIDENCE_VERDICT","moduleIdentity":{"byteLength":23192,"sha256":"fdddfe45d695f5bb6b0f727119b7df6d4e974ed2fe6e1301f174fadee27f3ea4"},"modulePath":"packages/contracts/src/incoming-invoice-ap05-receipt-manifest.ts","observed":"SCHEMA_VALIDATED","ordinal":8}],"dataflow":{"dataflowDigest":"7439c7724296af12b0c7f82b4b965448937833cefaad3fdc7ded53f54ff28e64","documentContentSha256":"fad5979234e5ca8d31e2a10e7a9650c5f4f32693610c2fcf2678b0ab5a5f525b","documentVersionId":"version:sha256:534b1785fb9ba1ecfddbb060e21fabaccbf95d9aa0c7412703578af772ae96b4","ervCaseId":"ap-dataflow:doc:synthetic:ap-02:supplier-invoice-v1:SYN-INV-2026-0001","ervDecision":"MATCHED","extractionInputSha256":"fad5979234e5ca8d31e2a10e7a9650c5f4f32693610c2fcf2678b0ab5a5f525b","extractorId":"ap-02-bounded-key-value-extraction/v1","observedFieldsDigest":"e340d085f52dfd0773228546da917158ef38fde8150dd05fdb8705ef5bd73d33","observedGrossAmountMinor":12345,"purchaseOrderNumberState":"UNKNOWN","receiptReferenceState":"UNKNOWN","recordDigest":"24b1ecb21a25bebd17bb4f6af533efd3b58a425c1cc87a6b6dfe4d2ff1a63e83","schemaVersion":"chimpmaera.incoming-invoice/extraction-dataflow/v2","verified":true},"evidenceClasses":["SOURCE_BOUND","SCHEMA_VALIDATED","EXECUTED"],"frozenInputsExcluded":[{"excludedFromProofInputs":true,"note":"The AP-03 scoring harness and its holdout are source-bound only and are excluded from the proof inputs; they are not execution evidence for this dataflow and no OCR/model-quality claim is made (#378 remains separate).","path":"packages/contracts/src/incoming-invoice-extraction-benchmark.ts","releaseId":"extraction-benchmark-source-v1","role":"FROZEN_SYNTHETIC_EXTRACTION_SCORING_HARNESS"},{"excludedFromProofInputs":true,"note":"The frozen holdout is not an input of this dataflow and is never presented as extraction output.","path":"tests/fixtures/incoming-invoice/ap-03-holdout-v1.json","releaseId":"ap03-holdout-source-v1","role":"FROZEN_LOCAL_SYNTHETIC_HOLDOUT"}],"historicalScoping":{"note":"The v1 probe artifact is retained byte-for-byte and explicitly scoped to its historical release line; it is superseded, not overwritten. Its generic exercised flag is not reused here.","probeV1Identity":{"byteLength":11243,"sha256":"183d4fb117b9e5996b61f740d89fcf8b47d92fdb911f7567d94dc190f58b7194"},"probeV1Path":"verification/incoming-invoice-ap06-proof-probe-v1.json","scope":"HISTORICAL_RELEASE_LINE_NOT_CURRENT_SOURCE"},"issue":"JoFe2/PANSPHAIRA#488","nonclaims":["NO_CUSTOMER_DATA_EVALUATED","NO_EXTERNAL_PROVIDER_EVALUATED","NO_PRODUCTIVE_ALLOCATION_OR_POSTING_AUTHORIZED","NO_BOOKING_AUTHORITY_GRANTED","NO_LIVE_ERP_SYSTEM_CLAIM","NO_OCR_OR_MODEL_ACCURACY_CLAIM","NO_INVENTED_CAPABILITY_OR_AUTHORITY"],"predecessorBinding":[{"bytes":7414,"path":"packages/contracts/src/incoming-invoice-blueprint.ts","releaseId":"ap01-blueprint-source-v1","sha256":"aad1b877c096d4605b80b141100897fab41f62622f5434be59059989b8514550"},{"bytes":17628,"path":"packages/contracts/src/incoming-invoice-intake.ts","releaseId":"ap02-intake-source-v1","sha256":"38490af300dce7965deebf56755ac59be117db711bd7bc478e19538947a412fc"},{"bytes":153,"path":"tests/fixtures/incoming-invoice/supplier-invoice-v1.txt","releaseId":"ap02-intake-source-v1","sha256":"fad5979234e5ca8d31e2a10e7a9650c5f4f32693610c2fcf2678b0ab5a5f525b"},{"bytes":16353,"path":"packages/contracts/src/incoming-invoice-extraction-benchmark.ts","releaseId":"extraction-benchmark-source-v1","sha256":"f64575a455e69906f930d8b9c0b6303a73c1a3896d98a9b451aee488229b52df"},{"bytes":2991,"path":"tests/fixtures/incoming-invoice/ap-03-holdout-v1.json","releaseId":"ap03-holdout-source-v1","sha256":"41959bab323542694b120f8d55314620c214f3a44f7c8d36270e47ac8f9b9edb"},{"bytes":21114,"path":"packages/contracts/src/incoming-invoice-erv.ts","releaseId":"ap04-erv-core-v1","sha256":"6ba5250783df35f60602a11437c843272ab014bf24e69135cfbf52dfb41750cf"},{"bytes":19841,"path":"tests/fixtures/incoming-invoice/ap-04-erv-cases-v1.json","releaseId":"ap04-erv-core-v1","sha256":"136bbdfcb61bf48ab0043d828dbf797e9b9156f58d284cc7f9b921da590408